{
  "name": "Your Service Name",
  "firstPage": "firstPage",
  "productName": "Demo",
  "homePageUrl": "",
  "cookieSecret": "0123456789-abc",
  "pages": [
    {
      "id": "firstPage",
      "nextPage": "secondPage",
      "elements": [
        {
            "type": "Form",
            "elements": [
                {
                    "type": "ErrorList",
                    "title": "There is a problem"
                  },
                  {
                    "type": "DatePickerField",
                    "name": "f-dateInput",
                    "displayText": "Event Date",
                    "hint": "Please provide the date of the event.",
                    "validation": {
                        "regex": "^([0-9]|0[1-9]|[12][0-9]|3[01]) ([0-9]|0[1-9]|1[0-2]) (19|20)\\d{2}$",
                        "error": "Wrong format",
                        "isMandatory": true,
                        "mandatoryError": "Cannot be left empty"
                    }
                  },
                  {
                    "type": "SubmitButton",
                    "displayText": "Save and Continue"
                }
            ]
          }
        ]
      },
    {
      "id": "secondPage",
      "nextPage": "null",
      "elements": [
        {
            "type": "Form",
            "elements": [
              {
                    "type": "Summary",
                    "fieldNames": [
                      "f-dateInput"
                    ]
                }
            ]
          }
        ]
      }
    ]
  }
