{
    "name": "Your Service Name",
    "firstPage": "firstPage",
    "productName": "Demo",
    "homePageUrl": "",
    "cookieSecret": "0123456789-abc",
    "pages": [
      {
        "id": "firstPage",
        "nextPage": null,
        "elements": [
          {
            "type": "BulletedListField",
            "name": "bulletedListField",
            "displayText": "Testing Bulleted list. This is display text.",
            "items": [
                {"text": "Item 1"},
                {"text": "Item 2"},
                {"text": "Item 3"}
            ]
          }
        ]
      }
    ]
  }