{
    "name": "backbutton test",
    "firstPage": "firstPage",
    "productName": "example.com",
    "homePageUrl": "https://example.com",
    "cookieSecret": "0123456789-abc",
    "pages": [
      {
        "id": "firstPage",
        "nextPage": "secondPage",
        "preRequisiteData": null,
        "validation": null,
        "elements": [
          {
            "type": "Row2",
            "elements": [
              {
                "type": "Column",
                "columnWidth": "two-thirds",
                "elements": [
                  {
                    "type": "Form",
                    "classes": "",
                    "elements": [
                      {
                        "type": "ErrorList",
                        "title": "There is a problem"
                      },
                      {
                        "type": "SubmitButton",
                        "displayText": "Submit"
                      }
                    ]
                  }
                ]
              }
            ]
          }
        ]
      },
      {
        "id": "secondPage",
        "nextPage": "",
        "preRequisiteData": null,
        "validation": null,
        "elements": [
          {
            "type": "Row2",
            "elements": [
              {
                "type": "Column",
                "columnWidth": "two-thirds",
                "elements": [
                  {
                    "type": "Form",
                    "classes": "",
                    "elements": [
                      {
                        "type": "ErrorList",
                        "title": "There is a problem"
                      },
                      {
                        "type": "BackButton",
                        "displayText": "Back",
                        "classes": "govuk-button--secondary"
                      }
                    ]
                  }
                ]
              }
            ]
          }
        ]
      }
    ]
  }
  