{
    "name": "Email Address Input Demo",
    "firstPage": "firstPage",
    "productName": "Demo",
    "homePageUrl": "",
    "cookieSecret": "0123456789-abc",
    "footer": {},
    "pages": [
      {
        "id": "firstPage",
        "nextPage": "secondPage",
        "elements": [
          {
            "type": "Form",
            "elements": [
              {
                "type": "ErrorList",
                "title": "There is a problem"
              },
              {
                "type": "EmailField",
                "name": "email",
                "displayText": "What is your email address?",
                "labelClasses": "govuk-fieldset__legend--l",
                "isPageHeading": true,
                "validation": {
                  "isMandatory": true
                }
              },
              {
                "type": "SubmitButton",
                "displayText": "Save and Continue"
              }
            ]
          }
        ]
      },
      {
        "id": "secondPage",
        "nextPage": null,
        "elements": [
          {
            "type": "Summary",
            "title": "Summary title",
            "fieldNames": ["email"]
          }
        ]
      }
    ],
    "apiMappings": {},
    "apiServiceDefinition": {
      "openapi": "3.0.1",
      "info": {
        "title": "api",
        "version": "1.0.0"
      },
      "paths": {}
    }
  }